Application Date,Contact Email,Contact Phone Number,Company Name,Job Title,Job Url,Resume Name,Question And Answers
"5/15/25, 8:42 PM",gmahathi1@gmail.com, +14707165941,Simular,Software Engineer Intern,http://www.linkedin.com/jobs/view/4136361888,Gumudavelli_Mahathi_RS.pdf,"Is solving a problem more important than understanding why it works?:No | Do you think meetings are mostly unnecessary for developers?:No | If a problem is taking too long to solve, do you move on and come back later?:Yes | Do you think a perfect solution is always better than a working one?:No | Email address:gmahathi1@gmail.com | Do you believe meeting deadlines is more important than writing perfect code?:Yes | Mobile phone number:+1 4707165941 | Do you get frustrated when requirements change after you’ve already started coding?:No | If you find a new framework that seems useful, do you immediately switch to it?:No | Do you prefer working alone because it’s easier to control the outcome?:No | Please submit a resume or LinkedIn profile:-2026763790.pdf | Do you feel more comfortable communicating through code than words?:No"
"5/6/25, 4:54 PM",gmahathi1@gmail.com, +14707165941,Dwellci AI,Machine Learning Development Intern,http://www.linkedin.com/jobs/view/4223203542,Gumudavelli_Mahathi_RS.pdf,"Email address:gmahathi1@gmail.com | Do you have any experience with optimization models or algorithms (e.g., constraint satisfaction, linear/integer programming, evolutionary algorithms)?:Yes | Please submit a resume or LinkedIn profile:-2026763790.pdf | Do you have any experience with architectural tools, formats, or design tech (e.g., CAD, Revit, Rhino, BIM)?:Yes | Are you legally authorized to work in the United States?:Yes | Are you open to starting with an unpaid internship that may lead to a paid full-time opportunity?:No | Mobile phone number:+1 4707165941 | Will you now, or in the future, require sponsorship for employment visa status (e.g. H-1B visa status)?:No"
"11/7/22, 12:13 PM",gmahathi1@gmail.com, +14707165941,Westfield Specialty Insurance,"2023 Summer Intern Program- Alpharetta, GA",http://www.linkedin.com/jobs/view/3342196284,MAHATHI_GUMUDAVELLI_RS_.pdf,Mobile phone number:+1 4707165941 | Are you currently enrolled as a full time student in a 4 year college or university?:Yes | Are you age 18 or older?:No | Are you legally authorized to work in the United States?:Yes | Email address:gmahathi1@gmail.com | Please submit a resume or LinkedIn profile:572967123.pdf
"5/6/25, 4:19 PM",gmahathi1@gmail.com, +14707165941,Accretional,Software Engineering Intern (AI/ML),http://www.linkedin.com/jobs/view/4223203805,Gumudavelli_Mahathi_RSp.pdf,"Please submit a resume or LinkedIn profile:1614986693.pdf | Email address:gmahathi1@gmail.com | Are you legally authorized to work in the United States?:Yes | Will you have housing secured in the Bay Area during Summer 2025? (This is not required; just so we can know who will be working in person vs remotely):No | Mobile phone number:+1 4707165941 | Are you currently enrolled in a bachelors, masters, or PhD program in Computer Science or a related field?:Yes"
"5/15/25, 9:04 PM",gmahathi1@gmail.com, +14707165941,FurtherAI,Software Engineer - Frontend (Web),http://www.linkedin.com/jobs/view/4139514974,Gumudavelli_Mahathi_RS.pdf,Please submit a resume or LinkedIn profile:1229032018.pdf | How many years of work experience do you have with React.js?:2 | Are you comfortable commuting to this job's location?:Yes | Email address:gmahathi1@gmail.com | Mobile phone number:+1 4707165941
